{
  "schema_version": "2.0",
  "topic_id": "topic.host-header-attacks",
  "learning_objectives": [
    { "id": "LO1", "observable_action": "Given a request/response pair, identify whether a client-controllable header is reflected into generated output that a separate party will later trust.", "success_criteria": "Learner correctly names the specific header and the specific output it influences, without being told in advance that a header is involved." },
    { "id": "LO2", "observable_action": "Design a minimal, safe experiment to test whether a suspected header-trust gap actually changes application-generated output.", "success_criteria": "Proposed experiment isolates the header as the only changed variable and specifies what result would confirm vs. rule out the hypothesis." },
    { "id": "LO3", "observable_action": "Distinguish a primitive from a proven impact.", "success_criteria": "Learner explicitly identifies what additional fact is required before claiming real-world impact." }
  ],
  "scenarios": [
    {
      "scenario_id": "scenario.host-header-attacks.multi-tenant-invite-links",
      "title": "Multi-tenant workspace invite links",
      "context_domain": "A B2B SaaS product where each customer organization has its own workspace, reachable via a company-specific subdomain.",
      "prompt": {
        "setup": "A collaboration platform lets any employee invite teammates by entering an email address. The platform sends an invite email containing a link back to the workspace. The engineering team mentions, almost in passing, that the invite-link domain is 'derived from whatever the browser's request said it was talking to, so it works correctly no matter which of our regional edge domains the admin happened to load the app from.' The platform sits behind a shared reverse proxy that forwards all traffic to a single pool of application servers, and does not modify or strip any client-supplied metadata about the original request.",
        "task_question": "What capability, if any, does an attacker gain here, and what would you need to establish before claiming it results in account compromise of an invited teammate?"
      },
      "expected_reasoning": {
        "invariant_analysis": "A value used to determine 'which domain does this invite link point to' must reflect the platform's real, intended origin — not an arbitrary value the requester's browser happened to send.",
        "boundary_analysis": "The trust boundary is between the client's own request metadata (fully attacker-controlled) and the domain embedded into content that a separate person — the invited teammate — will later read and click.",
        "competing_hypotheses": [
          "The application ignores request-derived domain metadata entirely and uses a fixed, server-configured domain per workspace instead.",
          "The application reflects a client-controllable value directly into the invite link with no independent validation.",
          "The application validates one specific header for this purpose, but a different, related header used by the same code path bypasses that validation.",
          "The described behavior only affects which regional UI the admin's own browser loads, and does not affect the domain embedded in emails sent to other people at all."
        ],
        "minimal_safe_experiment": "Using a test workspace and a test invite address you control, trigger the invite flow twice: once normally, and once while modifying the relevant client-supplied header (or its likely forwarding-header sibling) to a domain you control. Compare the resulting invite email's link domain across both attempts.",
        "capability_calibration": "Observing the invite link's domain change demonstrates only the primitive. It does not prove account compromise: that additionally requires a real invited teammate to click the link, the link to carry a sensitive token, and no additional verification step between clicking and gaining account access.",
        "remaining_uncertainties": "Whether the invite link actually carries a sensitive, single-use token determines whether this primitive has any real impact at all; that must be confirmed from the invite email's actual contents, not assumed from the domain-substitution result alone."
      },
      "scoring_rubric": [
        { "dimension": "Invariant Identification", "description": "Can the learner state what should have determined the invite link's domain, and what determined it instead?", "levels": { "0": "Learner cannot articulate any expected guarantee about the invite link's domain.", "1": "Learner vaguely states 'the link should be correct' without identifying what makes it correct.", "2": "Learner identifies the domain should be the platform's own, but not what source of truth should determine it.", "3": "Learner correctly states the domain should derive from a server-controlled, validated source.", "4": "Learner additionally identifies the specific failure: trusting request-supplied metadata as if it were that validated source." } },
        { "dimension": "Boundary Mapping", "description": "Can the learner locate where untrusted, request-time data crosses into content a different, later party will trust?", "levels": { "0": "Learner does not distinguish the attacker's own request from the invited teammate's later action.", "1": "Learner notes 'the email is sent to someone else' without connecting it to a specific data source.", "2": "Learner identifies the invite email as the delivery point but not the specific header/metadata source.", "3": "Learner correctly identifies the client-supplied header as the untrusted input crossing into the emailed link.", "4": "Learner additionally notes the shared reverse proxy detail as relevant to which specific header is exploitable." } },
        { "dimension": "Hypothesis Quality", "description": "Are the learner's candidate explanations mutually exclusive and each independently testable?", "levels": { "0": "No alternative hypotheses offered; jumps straight to 'it's vulnerable.'", "1": "One hypothesis offered, untested against alternatives.", "2": "Two hypotheses offered but they overlap or aren't independently distinguishable.", "3": "Several distinct, testable hypotheses offered.", "4": "Hypotheses additionally include a 'no real effect' explanation, guarding against over-eager confirmation." } },
        { "dimension": "Safe Experiment Selection", "description": "Does the proposed experiment isolate the variable of interest while minimizing risk to real users?", "levels": { "0": "No concrete experiment proposed.", "1": "Experiment proposed but would affect a real, non-test teammate or workspace.", "2": "Experiment uses a test account but changes multiple variables at once.", "3": "Experiment isolates a single header change using a test workspace/invite address.", "4": "Experiment additionally anticipates testing the forwarding-header hypothesis as a distinct follow-up." } },
        { "dimension": "Capability Calibration", "description": "Does the learner separate 'the server will embed my value' from 'this results in account compromise'?", "levels": { "0": "Learner treats any domain reflection as automatic full compromise.", "1": "Learner asserts impact without naming any additional required condition.", "2": "Learner names one additional condition needed but not others.", "3": "Learner names multiple additional conditions.", "4": "Learner explicitly states the impact conclusion is unproven until the invite link's actual token/content is inspected." } },
        { "dimension": "Uncertainty Recognition", "description": "Does the learner identify what remains unknown rather than presenting a confident final verdict?", "levels": { "0": "Learner presents a definitive compromise/no-compromise verdict with no caveats.", "1": "Learner mentions uncertainty exists but does not specify what is uncertain.", "2": "Learner names one genuine unknown.", "3": "Learner names multiple genuine unknowns.", "4": "Learner ties each named unknown back to a specific next step that would resolve it." } }
      ],
      "common_learner_errors": [
        { "error": "Concluding the scenario describes SSRF because a server-side value is attacker-influenced.", "why_it_fails": "No server-side network request to an attacker-chosen destination occurs here. The mechanism is the same family but manifests as content generation, not a network fetch.", "remedial_guidance": "Focus on what capability is actually demonstrated: does the server perform a request to an attacker-chosen destination, or does it embed an attacker-chosen value into content that someone else will trust? These are distinguishable by what the server actually does with the value." },
        { "error": "Assuming that because the domain in the invite link changed, the invited teammate's account is now compromised.", "why_it_fails": "Changing the link's domain only proves the primitive. Compromise additionally requires the teammate to click the link, the link to carry something sensitive, and no further verification step to block reuse.", "remedial_guidance": "Explicitly separate 'I changed the link's destination' from 'I demonstrated account takeover', and identify the specific missing piece of evidence needed to close that gap." },
        { "error": "Testing only the most obvious header (Host) and concluding the application is safe when it shows no effect.", "why_it_fails": "The scenario's shared reverse proxy detail is a deliberate hint that a forwarding header, not necessarily Host itself, may be the actual trusted value.", "remedial_guidance": "Enumerate the plausible set of Host-like headers a proxied application might read before concluding the pattern does not apply." }
      ]
    }
  ]
}
